<?xml version="1.0" encoding="UTF-8" ?>

<testdata xmlns="http://aludratest.org/testdata" xmlns:xsi="http://www.w3.org/2001/XMLSchema-instance" 
	xsi:schemaLocation="http://aludratest.org/testdata http://aludratest.github.io/aludratest/schema/draft/testdata.xsd" 
	version="1.0">
    <metadata>
        <segments>
        <segment name="stringObject"
        	dataClassName="org.aludratest.util.data.StringData">
        <fields>
        	<field name="value" fieldType="STRING"/>
        </fields>
        </segment>
        </segments>
    </metadata>

    <configurations>
    <configuration name="config1">
    	<segments>
    		<segment name="stringObject">
    			<fieldValues>
    				<fieldValue name="value" script="true">
    					<value>new org.aludratest.scheduler.impl.DeferredEvalTestClass().setField()</value>
    				</fieldValue>
    			</fieldValues>
    		</segment>
    	</segments>
    </configuration>
    </configurations>
</testdata>